{
  "schemaVersion": "1.0.0",
  "catalogHash": "b339bbbf0b5d8e5c34e05b746688c14c9dd38b9d84f773dcbbbfec9f45c1092f",
  "environment": "example-project",
  "environmentRevision": "replace-with-actual-environment-revision",
  "checkedAt": "2026-10-19T00:00:00Z",
  "results": [
    {
      "ruleId": "SEC-001",
      "ruleHash": "630cc34d315bdd90cd3049bbb4fc8b535e686480bd8844107638a1c60c7fba15",
      "assetId": "example-unspecified",
      "status": "unverified",
      "scope": "Example only; no inspection performed",
      "evidence": [],
      "reason": "No environment evidence supplied",
      "proposedAction": "Inspect authorized scope and replace example metadata"
    },
    {
      "ruleId": "SEC-002",
      "ruleHash": "fce15249ac092c02acb7768669dba6026ba5fd7b7286c6f6f8c2b8a0cf50e942",
      "assetId": "example-unspecified",
      "status": "unverified",
      "scope": "Example only; no inspection performed",
      "evidence": [],
      "reason": "No environment evidence supplied",
      "proposedAction": "Inspect authorized scope and replace example metadata"
    },
    {
      "ruleId": "SEC-003",
      "ruleHash": "53b8db5192afb4ca38ea8ea3c1decb5012082faaab0d188b4c9070d72b32a257",
      "assetId": "example-unspecified",
      "status": "unverified",
      "scope": "Example only; no inspection performed",
      "evidence": [],
      "reason": "No environment evidence supplied",
      "proposedAction": "Inspect authorized scope and replace example metadata"
    },
    {
      "ruleId": "SEC-004",
      "ruleHash": "4c8742376f6fe13cb33908f282d1a6af6fd73ae0a13007f8013ca7042fd629b4",
      "assetId": "example-unspecified",
      "status": "unverified",
      "scope": "Example only; no inspection performed",
      "evidence": [],
      "reason": "No environment evidence supplied",
      "proposedAction": "Inspect authorized scope and replace example metadata"
    },
    {
      "ruleId": "SEC-005",
      "ruleHash": "08485996b2676665f7492aede8c0177923812df34709d710e114a5251290a0f1",
      "assetId": "example-unspecified",
      "status": "unverified",
      "scope": "Example only; no inspection performed",
      "evidence": [],
      "reason": "No environment evidence supplied",
      "proposedAction": "Inspect authorized scope and replace example metadata"
    },
    {
      "ruleId": "SEC-006",
      "ruleHash": "ad7cbc2bc9afdbcb758c4da2a02642a476025789a63a99dba6492fb724e09fdc",
      "assetId": "example-unspecified",
      "status": "unverified",
      "scope": "Example only; no inspection performed",
      "evidence": [],
      "reason": "No environment evidence supplied",
      "proposedAction": "Inspect authorized scope and replace example metadata"
    },
    {
      "ruleId": "SEC-007",
      "ruleHash": "154186523c183ea0ec0059b951eb9b35f0ac41557c28df13c071663be3aef6ee",
      "assetId": "example-unspecified",
      "status": "unverified",
      "scope": "Example only; no inspection performed",
      "evidence": [],
      "reason": "No environment evidence supplied",
      "proposedAction": "Inspect authorized scope and replace example metadata"
    },
    {
      "ruleId": "SEC-008",
      "ruleHash": "2f5ad60befb66cf498e0cc52fe6722d94c43986712a3ac56459ff4aa2e55edea",
      "assetId": "example-unspecified",
      "status": "unverified",
      "scope": "Example only; no inspection performed",
      "evidence": [],
      "reason": "No environment evidence supplied",
      "proposedAction": "Inspect authorized scope and replace example metadata"
    },
    {
      "ruleId": "SEC-009",
      "ruleHash": "3fefe4a7151a41b7b6afa07d8879003c47aa0423419a159ba0ecfaa7aba1494a",
      "assetId": "example-unspecified",
      "status": "unverified",
      "scope": "Example only; no inspection performed",
      "evidence": [],
      "reason": "No environment evidence supplied",
      "proposedAction": "Inspect authorized scope and replace example metadata"
    },
    {
      "ruleId": "SEC-010",
      "ruleHash": "66b39f4eb8a0f334e98e9388e3f9dab27415e726c0862f0b6a4a4dd10e5e81df",
      "assetId": "example-unspecified",
      "status": "unverified",
      "scope": "Example only; no inspection performed",
      "evidence": [],
      "reason": "No environment evidence supplied",
      "proposedAction": "Inspect authorized scope and replace example metadata"
    },
    {
      "ruleId": "SEC-011",
      "ruleHash": "3ae198ddd5fa82a53bcbca648d3a9070b03e3cd5665387e69e50c6bb6d365cb3",
      "assetId": "example-unspecified",
      "status": "unverified",
      "scope": "Example only; no inspection performed",
      "evidence": [],
      "reason": "No environment evidence supplied",
      "proposedAction": "Inspect authorized scope and replace example metadata"
    },
    {
      "ruleId": "SEC-012",
      "ruleHash": "2da99baf28980f61385469445d6c000edb5434471a4a3500f1775ca78467824a",
      "assetId": "example-unspecified",
      "status": "unverified",
      "scope": "Example only; no inspection performed",
      "evidence": [],
      "reason": "No environment evidence supplied",
      "proposedAction": "Inspect authorized scope and replace example metadata"
    },
    {
      "ruleId": "SEC-013",
      "ruleHash": "311a4937937933774491e1bbd55de99f51c947c72360af22a7b5bd57de3acc97",
      "assetId": "example-unspecified",
      "status": "unverified",
      "scope": "Example only; no inspection performed",
      "evidence": [],
      "reason": "No environment evidence supplied",
      "proposedAction": "Inspect authorized scope and replace example metadata"
    },
    {
      "ruleId": "SEC-014",
      "ruleHash": "d9142da38fbe305f72d506a6d6c3c97f658fa446587dc9b27657622c880c1163",
      "assetId": "example-unspecified",
      "status": "unverified",
      "scope": "Example only; no inspection performed",
      "evidence": [],
      "reason": "No environment evidence supplied",
      "proposedAction": "Inspect authorized scope and replace example metadata"
    },
    {
      "ruleId": "SEC-015",
      "ruleHash": "1dfd83077658a79d47897d199f646eb9f69aa4d92c7646c57f2b82a715fde44c",
      "assetId": "example-unspecified",
      "status": "unverified",
      "scope": "Example only; no inspection performed",
      "evidence": [],
      "reason": "No environment evidence supplied",
      "proposedAction": "Inspect authorized scope and replace example metadata"
    },
    {
      "ruleId": "SEC-016",
      "ruleHash": "cce435bbacb6fef88c9e9d661222b081d8463e4f025448a7796cdcddd7548488",
      "assetId": "example-unspecified",
      "status": "unverified",
      "scope": "Example only; no inspection performed",
      "evidence": [],
      "reason": "No environment evidence supplied",
      "proposedAction": "Inspect authorized scope and replace example metadata"
    }
  ]
}
